{
  "meta": {
    "schemaVersion": "1.0",
    "sourceText": "VLIZ test",
    "ingestionMethodId": 4,
    "contactId": 1021773,
    "observedAt": "2026-03-12T14:30:00Z"
  },
  "options": {
    "mode": "UPSERT",
    "dryRun": false,
    "createIfMissing": {
      "platform": false,
      "sensorSetups": false
    }
  },
  "platform": {
    "match": {
      "wigosId": "0-22000-0-6204817"
    },
    "patch": {
      "name": "ICOS STATION Thornton Buoy",
      "deployment": {
        "date": "2018-11-30T00:00:00Z",
        "latitude": 51.57989,
        "longitude": 2.993217
      }
    }
  },
  "contactContributions": [
    {
      "contactId": 1022493,
      "roles": ["principal-investigator"]
    },
    {
      "contactId": 1021773,
      "roles": ["i-t-engineer"]
    }
  ],
  "agencyContributions": [
    {
      "agencyId": 1001497,
      "roles": ["owning-agency", "operating-agency", "data-assembly-center"]
    }
  ]
}